{
  "version": 1,
  "timeoutMs": 10000,
  "criteria": [
    {
      "id": "deployment",
      "description": "The deployment serves the verified commit and expected health data."
    }
  ],
  "checks": [
    {
      "id": "health-endpoint",
      "type": "http",
      "url": "https://example.invalid/health",
      "expectedStatus": 200,
      "bodyContains": "healthy",
      "criteria": [
        "deployment"
      ],
      "bodySha256": "e3b0c44298fc1c149afbf4c8996fb92427ae41e4649b934ca495991b7852b855",
      "maxBodyBytes": 65536
    },
    {
      "id": "health-data",
      "type": "http",
      "url": "https://example.invalid/health.json",
      "bodyJsonPointerEquals": {
        "pointer": "/status",
        "expected": "healthy"
      },
      "criteria": [
        "deployment"
      ]
    }
  ]
}
